{
  "schema_version": 1,
  "source_id": "login-lab-a",
  "event_id": "22222222-2222-4222-8222-222222222222",
  "stream_id": "11111111-1111-4111-8111-111111111111",
  "sequence": 1,
  "occurred_at": "2026-01-01T00:00:00.000Z",
  "event_type": "login.success",
  "account_token": "aaaaaaaaaaaaaaaaaaaaaaaaaaaaaaaaaaaaaaaaaaaaaaaaaaaaaaaaaaaaaaaa",
  "client_token": "bbbbbbbbbbbbbbbbbbbbbbbbbbbbbbbbbbbbbbbbbbbbbbbbbbbbbbbbbbbbbbbb",
  "reason_code": "SUCCESS",
  "event_digest": "51bfc28de6fa91fa7c10efe09bcae2c2b038aae8636bbaa3d6b9a3b67a87f86c"
}
